{
  "schemaVersion": "guard.extension-contribution.v1",
  "id": "command.keibidrop",
  "version": "1.0.0",
  "name": "KeibiDrop",
  "description": "Reviews kd commands that share a local file with a peer, write a peer's file to local disk, or set which peer identity the session accepts.",
  "trustClass": "external",
  "activation": "opt-in",
  "publisher": {
    "id": "community.marius-cristian",
    "displayName": "Community",
    "url": "https://github.com/KeibiSoft/KeibiDrop"
  },
  "icon": { "kind": "react-icon", "name": "HiMiniCloud", "background": "#0E7490" },
  "license": "MPL-2.0",
  "homepage": "https://keibidrop.com/",
  "executables": ["kd"],
  "ecosystemIds": ["keibidrop"],
  "riskClasses": ["data_flow_exfiltration", "destructive_shell", "network_egress"],
  "actionClasses": [
    "keibidrop file share command",
    "keibidrop remote file write command",
    "keibidrop peer authorization command"
  ],
  "referenceUrls": [
    "https://github.com/KeibiSoft/KeibiDrop",
    "https://keibidrop.com/docs/reference/kd-cli.html"
  ],
  "saferAlternatives": [
    "Run kd list and kd status to see what is shared and who is connected.",
    "Give kd pull an explicit local path instead of the peer's name.",
    "Check a peer code against the one you were sent before registering it."
  ],
  "detector": {
    "kind": "python-module",
    "module": "codex_plugin_scanner.guard.runtime.command_keibidrop_extensions"
  }
}
